__index_level_0__,answers,context,document_id,question,title
2270,"{'answer_start': [713], 'text': ['4분의 3']}","의대생과 수의사들은 한 달 넘게 여기저기서 폭동을 일으키며 연대했다. 1906년 12월 11일, Ritchie Lind af Hagvi가 조직한 반생물학적 시위가 수백 명의 학생들이 침입하여 의자를 던지면서 취소되었습니다. 데일리 크로니클은 ""린다 아프 해그비 양의 분노가 남아 있던 이후로 회의장은 아름다운 '달걀'로 가득 찼다. 한 학생은 '양말을 갈아입으세요!'라고 외쳤다. ""라고 보고했다. 행사장에 있던 가구들이 산산이 부서지고 참가자들의 옷이 찢어졌습니다. \n\n뉴잉글랜드 대학교의 수잔 맥휴가 동상을 보호하기 위해 달려갔을 때 동상 앞에는 다양한 정치적 견해를 가진 사람들이 서 있었습니다. 노동조합 활동가, 사회주의자, 마르크스주의자, 자유주의자, 참정권주의자들이 배터시에서 의대생들과 싸우고 있었다. 여성 참정권은 남성 노동자와 혼재되어 전혀 환영받지 못했다. 그러나 Susan McHugh는 그들 이전에 ""브라운 테리어 개를 죽게 만든"" 남성 과학자들이 있었고 그것만으로도 그들을 모두 통합하기에 충분했다고 썼습니다. \n\nRitchie Lind af Haggie와 Charlotte Despard는 이 사건을 페미니즘과 사나이의 대결로 보았습니다. 호주의 역사가 코랄 랜스버리(Coral Lansbury)는 이번 사건이 여성 참정권 운동이 생물학적 실험 반대 운동과 밀접하게 연결될 수 있는 기회였다고 분석했다.  전국반생체실험협회의 부위원장 가운데 4분의 3이 여성이었다. Lansbury는 갈색 개 사건을 반 생물 실험 운동에 여성의 참여로 이끄는 상징적 사건으로 보았습니다. 살아있는 실험을 위해 벤치에 묶인 개의 이미지와 Brixton Prison에 수감된 여성 참정권 운동가의 이미지가 겹쳐졌습니다. 또는 여성의 히스테리 치료라는 명목으로 행해지는 난소나 자궁 적출과 중복된다. \n\n사건에 대한 평가는 엇갈립니다. 영국의 역사가 Hilda Keen은 스웨덴의 페미니스트 활동가들은 젊은 여성이며 반체제적이고 진보적이며 과학자들을 구식 시스템의 유물로 보는 견해를 가지고 있다고 논평했습니다. 이는 ""새로운 형태의 증언""이라는 평가를 받았다. 대조적으로 Lansbury는 의대생들이 자신과 교사를 ""새로운 사제""로 보았고 여성과 노동 조합 활동가는 미신과 감상을 대표한다고 썼습니다.",mrc-0-003459,전국반생체실험협회의 부위원장을 맡은 사람 중 여자의 비율은 어느정도였는가?,갈색 개 사건
986,"{'answer_start': [252], 'text': ['비리 사건']}","충청북도 청주에서 태어나 청주농림학교를 졸업했다. 학교를 졸업하고 충청북도 내무부 회계과에서 근무하여 총독부 관료가 되었습니다. \n\n그 후 충청북도, 영동군, 충주군, 옥천군 내무부, 총독부 전주지방독점국 대전지부에서 근무했다. 대한민국. 1941년 진천군지사 때 7대 즉위하였다. \n\n진천군 이후에는 제천군수를 지냈고, 태평양 전쟁이 끝난 후에는 사업가로 전업했다. \n\n조선식량영단 후신인 대한식량공사 경리부장을 지내던 중, 1949년에 비리 사건이 적발되어 이사진이 물러나면서 후임 이사에 임명되었다. \n\n6.25전쟁 발발 직전 쌀값이 치솟는 등 식량문제가 문제가 되었을 때, 나는 식량배급을 통해 어려운 상황을 극복해야 한다고 주장하는 편이었다. 이때 그의 직함은 한국금융지원협회 곡물이사였다. \n\n한국 전쟁이 시작될 때 서울 거주지에서 사라졌습니다. 조선민주주의인민공화국에 납치된 것으로 추정된다. \n\n2008년 발간된 민족문제연구소 친일사전 등재예정인원의 관료란에 포함되어 있었다.",mrc-1-001518,1949년 대한식량공사 이사들의 퇴임은 무엇 때문인가?,오병문 (1899년)
725,"{'answer_start': [556], 'text': ['모스크바']}","2월 11일, 티모센코 원수 휘하의 새로 모집된 부대가 전면 공격을 개시했습니다. 그로부터 2주 반 동안 소련은 핀란드 방어 체계를 반복적으로 공격하고 내륙을 침공했다. 핀란드인들은 지쳐 눈물을 흘리며 후퇴했습니다. 상황이 이 지경에 이르자 이전에 거절당한 사람들을 모집하고 부상자를 재소집하고 10대 학생들의 자발적인 조직을 조직하는 것이 필사적인 노력 중 하나였습니다. 하지만 도움이 되기보다는 오히려 방해가 되는 경우가 많았습니다. \n봄이 되자 만네르헤임 휘하의 병사들은 여전히 ​​국지적으로 반격을 가해 승리를 거머쥐었지만, 현실적으로는 포탄이 거의 소진된 상태였고, 동원할 수 있는 모든 병력이 전투에 참여하고 있었다. 당시 탈벨라는 이렇게 표현했다. “모든 곳이 위험에 처해 있습니다. ""핀란드의 수비가 한 구석에 무너지면 핀란드 전체가 무너질 것입니다. 만네르헤임도 패배의 순간이 왔다는 것을 알고 있었다. 핀란드의 사상자는 증가하고 있었다. 이것은 만네르헤임이 협상을 통해 전쟁의 종식을 제안하도록 강요했습니다.  1940년 3월 6일, 핀란드는 평화를 모색하기 위해 대표단을 모스크바로 보냈다.",mrc-1-001107,핀란드의 대표단이 1940년 3월 6일에 향한 곳은?,겨울 전쟁
2293,"{'answer_start': [554], 'text': ['언어의 사용']}","언어의 기원에 대한 논의는 가장 오래된 주제 중 하나입니다. 그러나 인간의 말은 순간적인 특성으로 인해 이 주제를 뒷받침할 데이터가 많지 않습니다. 많은 학자들은 언어의 기원이 문화, 도구 사용, 사회 구성과 같은 행동적 근대성의 발달과 직접적인 관련이 있다고 믿습니다. \n\n인류의 진화 과정에서 원시 언어의 말이나 비언어적 의사 소통 수단을 통한 고급 의사 소통 시스템의 개발이 이루어졌다는 것은 알려져 있지만 그 과정이 어떻게 만들어 졌는지 논의의 대상입니다. 열쇠가 되다 현존하는 모든 인간 집단이 말을 통해 체계화된 언어를 사용한다는 점은 주목할 만하다. (피진은 때때로 외부에서 사용됩니다. ) 기존의 언어들은 세부적으로는 약간의 차이가 있지만 모두 충분한 어휘와 통사구조를 가지고 있으며, 개념을 표현하기 위한 새로운 문장의 생성이 가능하다. \n\n호모 사피엔스는 분명히 언어를 사용하는 타고난 능력을 가지고 있으며 다른 종은 이 능력을 가지고 있지 않습니다. 그러나 네안데르탈인과 같은 다른 멸종된 유인원 종이 언어 능력을 가지고 있었는지 여부는 알려져 있지 않습니다.  언어의 사용은 호모 사피엔스를 다른 동물과 구별시켜주는 가장 두드러지고 특징적인 자질이다.",mrc-0-003497,다른 동물과 다르게 호모 사피엔스만 가지고 있는 특징은?,언어의 기원
2878,"{'answer_start': [242], 'text': ['자금']}","최초의 표현주의 영화는 칼리가리 박사의 방과 노스페라투였다. \n\n1916년 정부는 외국 영화를 금지했고 극장 ​​수요는 영화 제작을 자극하여 연간 25편에서 130편으로 늘어났습니다. 한국뿐만 아니라 1922년 독일 영화에 대한 국제적 관심이 높아졌다. 1916년 금지령이 해제되면서 독일은 국제 영화 산업의 일부가 되었습니다. \n\n1920년대 유럽의 다양한 문화는 새로운 아이디어와 스타일을 실험하고 변화를 시도했습니다.  자금이 부족했던 최초의 표현주의 영화들은 비현실적이고 기하학적으로 이상한 배경을 사용하였고, 소품과 조명은 벽과 바닥에 그리는 방식으로 표현했다. 액션/로맨스 영화에 비해 광기, 배신, 지적인 주제를 다룬 콘텐츠. 후기 표현주의 영화에는 Fritz Lang의 Metropolis와 M(1931년 영화)이 있습니다. 이러한 경향은 사실주의에 대한 직접적인 반응이었다. 극도의 왜곡은 외면보다는 내면의 현실을 표현하기 위해 사용되었다. \n\n표현주의의 극단적인 비현실주의는 오래가지 못했지만 표현주의의 소재는 1920년대와 1930년대의 영화에 흡수되었습니다. 그 후 몇몇 독일 영화인들이 미국으로 이주하여 성공적인 할리우드 영화를 만들었습니다. \n\n특히 공포영화와 느와르 영화는 독일 표현주의의 영향을 많이 받은 장르입니다.",mrc-0-004408,맨 처음 표현주의영화들이 이상한 배경을 사용하게 된 이유는 무엇이 모자랐기 때문인가?,독일 표현주의
1836,"{'answer_start': [212], 'text': ['화살표']}","마우스와 같은 포인팅 장치 역할을 하는 인터페이스는 보조 커서를 추가하여 마우스 포인터(마우스 포인터)의 위치를 ​​표시합니다. Linux 콘솔과 많은 MS-DOS 프로그램을 포함하는 텍스트 사용자 인터페이스에서 커서는 종종 직사각형입니다. 인터페이스에 따라 이 사각형은 항상 한 가지 색상 또는 그 아래에 반대 색상을 가질 수 있습니다. \n\n그래픽 사용자 인터페이스는 보통 화살표 모양의 포인터를 사용하여 마우스 위치를 가리킨다. 문자열 커서의 깜박임은 일반적으로 커서가 이동될 때 일시적으로 멈춥니다. 일시 정지하지 않으면 커서 위치가 변경될 때 위치를 찾기가 쉽지 않을 수 있습니다. 수많은 TUI 및 GUI는 사용자에게 텍스트 입력에 마우스 커서를 사용하지 않는 옵션을 제공합니다. \n\n많은 그래픽 사용자 인터페이스에서 마우스 커서는 환경에 따라 모양이 바뀝니다. 예:\n* 사용자가 선택하고 편집할 수 있는 문자열에서 커서는 위쪽과 아래쪽에 작은 볼트가 있는 수직 막대로 변경됩니다. \n* 문서를 볼 때 커서는 모든 손가락이 있는 손을 나타냅니다. \n* 그림을 편집할 때 브러시, 연필과 같은 그래픽 편집 커서가 나타납니다. \n* 창 가장자리에서 커서는 일반적으로 두 개의 화살표로 바뀝니다. (세로, 가로 또는 대각선 화살표 커서) 사용자가 표시된 방향으로 가장자리를 끌어 크기나 모양을 변경할 수 있음을 나타냅니다. \n* 컴퓨터 처리가 사용 중이거나 사용자 입력을 수락할 수 없는 경우 대기 커서를 표시합니다. \n* 커서가 하이퍼링크 위에 있으면 손가락 커서로 바뀝니다. \n\nWindows 7 운영 체제에서는 제어판의 마우스 설정을 통해 색상, 모양, 크기, 클릭 시 반응 등 마우스 커서를 원하는 대로 조정할 수 있습니다.",mrc-0-002798,그래픽 사용자 인터페이스는 어떤 모양으로 마우스 위치를 나타내나요?,커서 (사용자 인터페이스)
635,"{'answer_start': [474], 'text': ['정운현']}","약한 지식인이라는 비판도 있다. '주체 없는 문명'의 몰락이었다는 비판도 있다. 결론적으로 정운현은 조선의 가능성을 과대평가하고 식민지의 '상황논리'에 빠져 결국 일본과 타협하게 된다. 그의 직업은 갑작스러운 변화가 아니라 유학 경험을 통한 자신감에서 나왔다. 그의 친일적 행동보다는 그의 친일적 논리에 주목하는 것도 이 때문이다. 김상태 서울대 교수는 ""윤치호는 일제강점기가 식민지 조선에 끼친 피해를 잘 알고 있었음에도 불구하고 자신의 신념 때문에 제국주의 비판을 무장해제시켜 무장해제했다""고 말했다. 사악한 이론에서. 이 판단에서 그가 선택할 수 있는 정치적 입장은 현상 유지, 즉 현실에 순응하는 것이었다.” 윤영실 수유연구소 연구원은 “문명만이 절대선이고 문명을 위해서는 강대국에의 종속이 불가피하다는 신념에 따라 미국과 조선보다 열등한 콤플렉스를 가지고 있었고, 결국 동양의 문명국인 일본과 타협하게 된 것이다."" 또한 낮아졌다 \n\n정운현은 그가 '지식인으로서의 ‘반성’은 차치하고 기독교인으로서의 ‘참회’ 한마디도 없다. 독립협회 회장과 <독립신문> 회장을 역임한 명색이는 해방 후 '자백'을 이렇게 남겼습니다. 또 '일본의 스코틀랜드화는 조선이 사는 길'이라며 일본의 '우호적인 식민통치'를 기대했던 약한 역사관이 친일의 길로 이끌었다고 비판했다. '주체 없는 문명'의 물결에 대한 부정적인 시각도 있다.",mrc-1-000979,윤치호가 일제의 '우호적인 식민통치'를 기대했다고 비판한 사람은?,윤치호
1133,"{'answer_start': [312], 'text': ['하라타 진지(原田甚次)']}","1592년 히데요시가 일으킨 임진왜란 중에도 병을 핑계로 외출을 하지 않았다. 그러나 이미 말했듯이 그는 히데요시에 대해 반항적인 태도를 계속했고 같은 해에 도시히사의 가신이 시마즈 가문의 가신인 우메키타 쿠니카네에 의해 히데요시(우메키타 잇키)에 대한 반란에 가담했습니다. 이 때문에 히데요시는 화를 냈다. 그래서 형 요시히사의 명을 받아 제압하려 했으나 추격자가 막고 류가미즈에 상륙했다.  몸을 제대로 가누지 못하였기 때문에, 제대로 자결하지 못한데다 추격자도 주군의 친동생에게 손을 대기를 꺼려하여, 도시히사가 “어서 목을 취하거라”라고 말한 뒤에야 하라타 진지(原田甚次)가 목을 취했다. 56세. \n\n유골을 확인한 결과 요시히사와 사세구에게 유언장을 남겼습니다. 유서에서 그는 “나는 몸이 아파 타이코(太子) 폐하 앞에 갈 수 없었고, 양심의 가책을 느낄 만한 일을 하지 않았다. 그러나 반란의 혐의를 받고 있기 때문에 시마즈 가문의 안전을 위해 탈취하려 한다. 가신은 항복하기 어려워 사무라이로서의 의무를 다하기 위해 어쩔 수 없이 전투에 임하지만, 형에게 절을 하는 것은 아니다. 그런 취지의 글이 있었다고 합니다.",mrc-1-001733,시마즈 도시히사를 참수한 사람은?,시마즈 도시히사
1736,"{'answer_start': [370], 'text': ['종교']}","Wright는 종교적 주제, 특히 '신' 개념의 역사와 진화에 대해 광범위하게 저술했습니다. 2009년 Bill Moyers가 신이 인간의 상상 속에만 존재하는지 물었을 때 Wright는 이렇게 대답했습니다. \n\n그렇게 말하고 싶습니다. 신이 인간의 상상의 산물이라 할지라도 신에 대한 인간의 관념은 계속해서 진화해 왔고, 이로써 인간은 그 궁극적인 목적과 의미에 더 가까워졌다. 인류는 진화 초기부터 인과관계의 기원을 상상하기 시작했습니다. 사람들은 배후에 무언가가 있기 때문에 무슨 일이 일어났다고 생각했습니다. 홍적세의 무당이 보여준 영적 경험은 오늘날 불교 승려들이 신적 또는 신적 존재에 대한 유효한 이해로 볼 것입니다.  하지만 대체로 위정자들은 종교를 대중을 통제하는데 사용하기 위한 이야기를 꾸며내었습니다. \n\n콜버트 보고서에서 라이트는 자신이 무신론자가 아니며 유대교, 이슬람교, 기독교와 같은 아브라함계 종교를 믿지 않는다고 말했습니다. 그는 창조론을 포함한 창조론을 반대합니다. Wright는 자연 선택에 대한 엄격한 유물론적 개념을 가지고 있습니다. 그러나 그는 자연선택 그 자체가 설계의 산물일 수 있다는 목적론적 주장을 부정하지 않는다. Wright는 ""인간이 하나님을 생각하는 방식이 변하고 있다""고 주장하며 종교는 엄격한 성경적 해석이 아니라 문화의 정치, 경제, 사회적 맥락에서 이해되어야 한다고 주장합니다. \n\nWright는 또한 자신을 세속적인 인본주의자이자 조직적 무신론에 비판적이라고 소개합니다. 그는 나쁜 종교와 옳은 종교를 구별할 수 있다고 말하며 나쁜 영향이 좋은 종교보다 크다는 데 동의하지 않습니다. 그는 조직화된 무신론이 대중에게 특정 사상을 강요하는 것은 역사상 얼마나 많은 종교가 사람들에게 개종을 강요했는지와 다르지 않다는 것을 알고 있습니다. 오늘날 모든 문제의 근본 원인을 종교라고 생각하는 것은 역효과입니다. \n\n불교가 참된 이유에서 그는 마음챙김 명상과 같은 세속적이고 서구화된 불교를 옹호하고 환생과 같은 초자연적 현상을 믿는 종교를 반대합니다. 그는 인간 고통의 원인에 대한 불교의 진단이 진화생물학과 진화심리학에 의해 뒷받침된다고 믿습니다. 그는 또한 마음 모듈 이론의 의미가 불교 가르침의 사심 이론과 유사하다고 주장합니다.",mrc-0-002647,대중을 통제하기 위해 위정자들의 수단이 되기도 한 것은?,로버트 라이트
2645,"{'answer_start': [331], 'text': ['특별 절차 위임 소지자']}","유엔인권이사회 총회는 표현의 자유와 표현의 자유 및 퍼블리시티권의 보호에 관한 특별보고관의 권고에 따라 특별보고관이 권고한 88건의 권고사항에 관한 문제에 관한 2011년 5월 보고서를 받았습니다. 여러 곰을 포함한 인터넷 액세스: \n\n: 67. 다른 미디어와 달리 인터넷은 개인이 국경을 넘어 모든 종류의 정보와 아이디어를 즉각적이고 저렴하게 찾고, 받고, 전달할 수 있도록 합니다. 인터넷은 다른 인권의 ""활성화""인 의견과 표현의 자유를 향유하는 개인의 능력을 크게 확대함으로써 경제, 사회 및 정치 발전을 촉진하고 인류 전체의 발전에 기여합니다.  이와 관련하여 특별 보고관은 다른 특별 절차 위임 소지자가 특정 임무와 관련하여 인터넷 문제에 참여할 것을 권장한다. \n: 78. 차단 및 필터링 조치는 사용자가 인터넷의 특정 콘텐츠에 액세스하는 것을 거부하는 반면 국가에서는 인터넷 액세스를 완전히 차단하는 조치를 취했습니다. 특별보고관은 지적 재산권법 위반 근거를 포함하여 제공된 정당화와 상관없이 사용자의 인터넷 액세스 차단이 과도하며 따라서 시민 및 정치에 관한 국제 규약 19(3)조를 위반한다고 생각합니다. 진실. \n: 79. 특별보고관은 모든 국가가 정치적 불안의 시기를 포함하여 항상 인터넷 액세스를 유지하도록 촉구합니다. \n: 85. 인터넷이 다양한 인권을 실현하고 불평등을 해소하며 개발과 인간 개발을 가속화하기 위한 필수 도구가 됨에 따라 인터넷에 대한 보편적인 접근을 보장하는 것은 모든 국가의 우선 순위가 되어야 합니다. 따라서 국가는 민간 부문 및 관련 정부 부처를 포함하여 사회의 모든 부문에서 개인과 협의하여 구체적이고 효과적인 정책을 개발하여 모든 인구 계층이 인터넷을 광범위하게 사용 가능하고 접근 가능하며 저렴하게 만들 수 있습니다. \n\n이러한 권장 사항은 인터넷 액세스 자체가 기본 인권이거나 그래야 한다는 제안으로 이어졌습니다.",mrc-0-004039,특별보고관은 특별한 임무와 관련된 인터넷 문제를 해결할 때 어떤 사람이 참여하기를 바라나?,디지털 권리
890,"{'answer_start': [463], 'text': ['무장인 정세운']}","1354년(공민왕 3년) 공민왕은 신돈을 왕으로 세웠으나 종의 아들이라는 신분을 문제로 삼은 권문세 가문의 반대로 궁에 들어가지 못했다. \n\n1358년(공민왕 7년) 공민왕의 개혁을 주도했던 이제현이 사임을 청원하고 직에서 물러났고, 공민왕은 왕사활을 사용하여 불교에 빠져들었다. 이때 신돈은 공민왕의 측근인 김원명(金元命)의 소개로 정식으로 개경궁에 들어섰고, 궁궐에 출입하기 전에 공민왕을 만났다. 이때 공민왕은 전날 꿈에 누군가가 칼을 빼어 그를 찌르려는데 스님이 와서 그를 구해주었다.  신돈은 총명하여 공민왕에게 중망(重望)받았고 공민왕 자신이 불교를 독실하게 신봉하여 불교에 관련한 일로 신돈을 자주 입궐시킬 수 있었으나 신돈의 명성과 특이한 성격과 낡은 사회질서에 구애받지 않는 태도에 대한 반발과 의구심과 편견이 심한 한편으로 “나라를 어지럽힐 자는 필히 이 중놈이리라!”라는 근거 없는 비산(誹訕)도 있었고 무장인 정세운은 요승(妖僧)이라 하여 신돈을 살해하려고 시도하여 공민왕이 그를 직접 피신시키기도 하였다. 공민왕은 신돈으로 개혁을 강력히 추진할 생각을 하고 있었다.\n\n김용의 계략으로 정세운을 비롯한 공민왕의 측근들이 정치계에서 많이 사라지자 신돈을 다시 불러 궁으로 들어갔다. . 공민왕의 개혁정책을 이끈 공민왕은 1364년 두타승(頭陀僧)이 되어 공민왕을 알게 되었고 마침내 궁궐에 살게 되었다. 그 후 공민왕에 의해 왕실에 임명되어 영예를 받고 궁에 들어갔다. 공민왕은 신돈의 의논을 받아 정부를 거역하지 않았고, 그 결과 갑자기 많은 신도를 얻었다.",mrc-0-001355,신돈을 죽이고자 했던 인물은?,신돈
461,"{'answer_start': [675], 'text': ['경우궁']}","갑신 쿠데타\n\n12월 4일에 처리될 각 과의 담당자의 임무도 이때 결정되었다. 이인종의 지휘 하에 이규완, 임은명, 윤경순, 최은룡이 별궁에 불을 지르는 자를 처형하기로 결정했다. 이때 변은 자루를 수십 개 만들어야 했기 때문에 별궁담을 건너 서광범의 남쪽 마당 안쪽과 별궁정전 안쪽에 자루를 짓기로 했다. 이것을 담당했다 수십 개의 자루를 만들어 화약을 채워 별궁 후문 서광범 가옥에 보관하고 별궁에 불을 질렀다. 또한 행진에는 기름을 채운 작은 병(화염병) 약 30개도 쌓였다.\n\n대신 수구파를 죽일 계획을 세웠을 때 민영익에게 배속됐다. 각 요소에 두 사람을 할당하기로 결정했습니다. 한 사람은 단검을, 다른 한 사람은 단총을 들고 있었습니다. 또한 그 위치에서 실패할 경우를 대비하여 조선특수옷을 입은 일본인 4명을 각각 1명씩 예비로 맡게 되었습니다. 이에 민영익은 윤경순과 이은종을, 윤태준은 박삼룡과 황용택을, 이주연은 최은동과 신신을 맡게 됐다. mo, 이규완, 임은명의 한규직. 찔렸다고 한다 \n\n12월 갑신정변 당시 사관생도들을 이끌고 우체국 근처에 매복해 우체국 취임식에 참석하기 위해 찾아왔으나 실패하는 민영익을 공격했다. 그러자 당시 경복궁을 지키던 윤태준이 철퇴로 죽임을 당했다. 윤태준은 당시 소정문 밖에서 기다리고 있던 이규완과 윤경순에게 일격에 사망했다.  \n\n경우궁에 당도한 이조연이 ""내 주상께 뵈옵고자 하노니 들어가게 하라""고 큰 소리로 말하면서 국왕 앞으로 나가려고 했다. 그러자 서재필은 검을 빼들며 ""이 문을 지키라는 명을 받은 이상 아무나 들어가게 할 수 없다. ""라고 말했고, 서재필의 부하들은 모두 눈을 크게 뜨며 한 발짝만 더 내딛으면 가만두지 않는다는 자세를 보였다. 이조연과 한규직은 경의궁 뒷문으로 갔다. 문을 나서자마자 황용택, 윤경순, 이규완, 고영석에게 살해당했다. 그 후 그는 군대를 이끌고 경복궁으로 진격하여 당시 신하였던 민영목(閔泳穆)과 조영하(趙寧夏)를 죽였다.",mrc-1-000718,서재필은 어느 궁을 지켰는가?,윤경순 (1855년)
