__index_level_0__,answers,context,document_id,question,title
2717,"{'answer_start': [63], 'text': ['남자']}","1959년 1월 28일에 이고르 댜틀로프를 중심으로 탐사대를 결성한 우랄 국립공과대학교 소속 스키 하이커 10명(남자 8명, 여자 2명)은 러시아 우랄산맥을 거쳐 오토르텐산을 등반하고 2월 12일에 베이스캠프가 위치한 비자이 마을로 복귀하려는 계획을 세웠다. 그러나 등반 당일인 1월 28일 유리유딘은 발열, 두통, 류머티즘, 심장병 등의 증상으로 원정대를 떠났고 나머지 9명은 등반에 나섰다. \n\n탐정단이 떠난 지 5일 만인 2월 1일 폭설로 기상 상황이 악화되자 비자이 마을에 남아 있던 유딘은 원정대에 무전 메시지를 보냈다. 원정대 대장인 디아틀로프는 유딘에게 ""대원들은 홀라트샬 산(죽음의 산) 능선에 있는 임시 야영지에서 휴식을 취하고 있으며 9명은 모두 무사하다. '라고 답장을 보냈다. 그러나 2월 2일부터 디아틀로프가 이끄는 원정대와의 연락이 갑자기 끊겼고, 귀국 예정일인 2월 12일에도 디아틀로프와 그의 일행은 돌아오지 않았다. \n\n구조대는 Ural National University of Technology 원정대가 실종되었다는 소식을 듣고 Mount Holatshahl에서 실종자를 찾기 시작했습니다. 2월 26일, 구조대는 원정대의 임시 캠프장으로 추정되는 곳에 도착했습니다. 원정대원 5명의 시신은 약 5km 떨어진 곳에서 수습됐지만, 나머지 실종자 수색은 악천후와 험준한 지형으로 인해 잠시 지연됐다. 구조대는 지난 5월 4일 소나무 숲에서 약 75m 떨어진 계곡에서 원정대원 4명의 시신을 수습했다. 하지만 구조대의 수색 작업 중 발견된 시신에 대해 여러 가지 의문점이 제기되고 있다. \n\n* 원정대원 9명이 살았던 텐트에 남겨진 찢어진 흔적은 외부에서 침입한 것이 아니라 내부에서 외부로 찢어진 흔적이다. \n* 최초의 원정대원 5명의 시신은 영하 -30도의 상태에서 속옷과 신발을 신지 않은 상태에서 발견되어 공포의 표정을 지었다고 한다. \n* 나중에 발견된 원정대원 4명의 시신은 물리적 충격으로 심하게 훼손되어 분해되었다. 등반가의 리더인 디아틀로프는 오른 주먹에 마치 주먹다짐을 한 것처럼 흉터가 있었다. 다른 두 명의 희생자는 두개골에 금이 가고 갈비뼈가 부러졌습니다. 그들 중 한 명은 두개골 상태가 너무 심각해서 움직일 수 있는 능력을 잃은 것으로 추정됩니다. 한 여성 교환원도 혀를 잃은 채로 발견되었습니다. \n* 현장에서 발견된 전나무가 불탔습니다. 원정대원들의 피부는 주황빛으로 변했고, 원정대원들이 입고 있던 옷에서 높은 수준의 방사능이 검출됐다.",mrc-0-004154,이고르 댜틀로프를 중심으로 만들어진 탐사대에서 다수를 차지한 성별은?,댜틀로프 고개 사건
3564,"{'answer_start': [668], 'text': ['전형적인 핑거스타일 방식']}","Funk는 강한 그루브를 만들기 위해 일렉트릭 베이스에서 연주되는 강한 리프와 베이스라인을 사용합니다. 모타운 앨범과 마찬가지로 펑크송은 베이스를 곡의 중심축으로 사용한다. 사실 펑크는 베이스가 노래의 '훅'을 연주하는 가장 두드러진 장르라고 불려왔다. 초기 펑크 베이스라인은 싱코페이션(보통 8분 음표를 싱코페이트함)을 사용했지만 뉴올리언스 펑크보다 더 많은 ""워킹""이 추가되면서 블루스 스케일 스케일과 함께 근음과 3음 음을 사용했습니다. 나중에 펑크 베이스라인은 16분음표, 블루스 음계 및 반복 패턴을 사용하며 종종 옥타브 이상의 음표가 있습니다. \n\nPunk의 베이스라인은 반복적인 패턴, 그루브, 지속적인 연주, 선명하고 터지는 베이스를 강조합니다. 특히 슬랩은 엄지손가락으로 치는 낮은 음과 나머지 손가락으로 튕겨낸 높은음을 섞어서 베이스가 드럼 같은 리듬으로 작용하도록 함으로써 펑크의 독특한 요소가 되었다. 눈에 띄는 건방진 펑키 선수로는 Bernard Edwards, Robert Bell, Mark Adams, Johnny Flippin 및 Bootie Collins가 있습니다.  펑키한 것도 중요하지만, 로코 프레스티아와 같이 펑크를 연주하는 일부 영향력 있는 베이시스트들은 이러한 방식을 사용하지 않았고, 대신 제임스 제이머슨의 모타운 플레이 스타일을 바탕으로 한 전형적인 핑거스타일 방식을 사용했다 . \n\n펑크에서 베이스는 음소거된 리듬에 고스트 음을 사용하기 때문에 부분적으로 ""타악기 느낌""이 있습니다. 일부 펑크 베이스 연주자는 ""엔벨로프 필터""와 같은 효과를 사용하여 악기의 음색을 변경하고 키보드의 신디사이저와 같은 베이스 톤도 이러한 베이스 톤을 생성하는 데 참조됩니다. Collins는 또한 Jimi Hendrix가 대중화한 옥타브 페달처럼 음표를 옥타브 위아래로 두 배로 늘려 ""미래적이고 둔한 저음""을 만들 수 있는 옥타브 페달을 사용했습니다.",mrc-0-005461,유명한 펑크 베이시스트의 일부는 어떤 방식으로 연주하였나?,펑크
977,"{'answer_start': [618], 'text': ['2014년']}","레바논-시리아 국경 분쟁\n\n2012년 초여름 레바논 영토에서 시리아 반군과의 충돌로 2명의 헤즈볼라 군인이 사망했습니다. 9월 17일, 시리아 전투기는 아살 북쪽 레바논 영토 국경에서 3발의 미사일을 발사했다. 그들은 시리아 반군을 추적한 것으로 믿어졌습니다. 이로 인해 미셸 아운 레바논 대통령은 조사에 착수했고 이번 사건에 대해 시리아 정부를 비난하지 않았다. \n\n2012년 9월 22일, 자유 시리아군의 무장 단체가 아살 근처의 전초 기지를 공격했습니다. 이것이 두 번째 침입이었다. 레바논의 공격으로 자유 시리아군은 고지대로 진격했고 추가 병력이 이 지역을 보호하기 위해 파견되었습니다. 미셸 슐레이만은 군의 행동이 ""다른 지역의 분쟁으로부터 중립을 유지하기 위한"" 레바논의 입장과 일치한다고 말했다. 시리아는 레바논 국경에 숨어있는 반군을 적극적으로 수색하고 진압할 것을 촉구했습니다. \n\n2012년 10월 11일, 시리아군이 발사한 4개의 포탄이 Masari al-Qaa 지역에 떨어졌습니다. 2012년 10월 하산 나스랄라는 시리아에 살고 있는 레바논인들이 자유 시리아군으로부터 마을을 방어했다고 주장하면서 시리아군과 헤즈볼라 전사들이 함께 싸운 것이 아니라고 부인했다.  \n\n2014년 8월, 시리아 공군은 레바논 쪽 국경 지역을 폭격했다. 그해 12월, 그들은 아살 북서쪽에 있는 시리아 반군 시설에 유도 폭탄을 투하했습니다.",mrc-1-001505,아살 북서쪽에 유도 폭탄이 떨어진 해는?,시리아 내전의 주변국 확산
3454,"{'answer_start': [84], 'text': ['토론토']}","크리스티역은 이후 정문에서 메자닌 층으로 이어지는 짤막한 에스컬레이터를 추가한 것을 제외하고는 역 구조상 별다른 변화가 이루어지지 않았다 크리스티역은 토론토 교통국 역사상 최악의 화재가 일어난 곳으로 알려져 있는데, 1976년 10월 15일, 방화범이 지하철 운행이 끝나갈 무렵 H-1 전동차 안에서 신문지에 불을 붙였다. 역 직원이 화재를 확인했을 때 기차는 크리스티 역에 정차했고 안에 있던 승객들은 대피했습니다. 그 결과 승객 10명과 직원 3명이 병원으로 옮겨졌고, 직원 2명은 연기 속 낮은 위치에 있는 오싱턴역으로 대피해야 했다. 새벽이 복원 작업에 투입되었습니다. \n\n이 화재로 인해 3개의 열차가 소실되었으며, 1개의 열차는 철도 유지 보수 차량으로 복원 및 개선되었습니다. TTC 직원은 역을 원래대로 복원하려 했지만 역의 바탕색인 녹색 타일이 부족해 적갈색 타일로 채워졌다. 메자닌 바닥은 베이지 대신에 노란색 타일로 채워져 있었습니다.\n\n이번 화재 외에는 역 건물 자체는 아직 큰 변화가 없습니다. 토론토 교통부는 2023년까지 모든 역에 엘리베이터를 설치한다는 계획에 따라 두 번째 출입구와 엘리베이터가 설치될 가능성이 높지만, 개통 당시의 모습은 그대로 유지될 예정이",mrc-0-005297,크리스티 역은 어느 도시에 있는가?,크리스티역
943,"{'answer_start': [57], 'text': ['병암리']}","이남호 소령이 이끄는 제3대대는 제2대대가 모도원에서 진천을 향하여 떠난 다음 엄호부대가 없는 가운데 병암리로 향하였다. \n\n동락대대가 08시 00분 동락리 부근을 지나가던 중 사이드카를 앞세운 적정찰부대와 충돌해 차량진군에서 전투태세를 취했고, 그 자리는 2사단이 점령했다. 어젯밤에 대대. 전개가 쉽기 때문에 즉시 사격 자세를 취하는 것이 가능했습니다. 한편, 북한군은 본선을 오가며 분주했다. \n\n대대장 이남호 소령은 지체 없이 적의 탈출로에 박격포 포탄을 집중 포격했고, 이어 정재갑 중위가 이끄는 9중대, 인성훈 중위가 이끄는 11중대가 뒤를 이었고, 반면에 10연대는 김성배 중위가 이끄는 중대와 류승원 중위가 이끄는 12중대는 화력으로 공격중대를 지원했다. \n\n이렇게 해서 대대는 퇴각하는 북한군을 모도원 북쪽으로 몰아내고 일격에 병암리로 진격하려 했으나 17시에 새로운 부대가 합류하여 대대장이 막고만 일몰까지 화력으로. 그러나 정면 대결의 불리함을 피하기 위해 9중대는 남겨두고 주력부대는 동락리의 구진지로 이동하여 북한군의 야간공격에 대비하였다. \n\n그런데 새벽까지 아무런 표시가 없었고, 9중대 정재갑 중위가 적당한 것을 찾지 못했다고 보고했다.",mrc-0-001436,"이남호 소령의 제3대대가, 제2대대가 진천으로 간 이후에 간 곳은?",동락리 전투
2177,"{'answer_start': [239], 'text': ['사냥']}","전라남도 진도군에서 예로부터 우리 조상들에 의해 길러져 온 한국의 견종입니다. 진돗개의 키는 수컷 50~55cm, 암컷 45~50cm입니다. 머리와 얼굴은 정면에서 봤을 때 팔각형이고 턱이 뾰족하고 전체적인 인상이 온화하다. 귀는 곧고 귀는 약간 앞으로 기울어져 있으며 눈은 삼각형이며 짙은 노란색 또는 회색입니다. 코는 거의 검은 색이며 때로는 분홍색 색조가 있습니다.  진도개는 성격이 대담하고 후각과 청각이 아주 예민하여 사냥에 적합하다. 또한 충성심이 강하고 영리하며 집에서 멀리 떠나도 집으로 돌아오는 성질이 있어 애완동물이나 가사도우미로 적합하다. \n\n가축을 기르는 유래는 삼국시대 남송(南宋)의 무역선이 진도 부근에서 난리를 쳤을 때 들어왔을 때, 진도의 난 동안 몽고 군견이 남아 있었다는 설에 있다. 삼별초는 고려시대에 시조가 되었고, 말 목장을 보호하기 위해 몽골에서 가져온 것이라는 설이 있다. 명확한 역사적 기록이 남아 있지 않아 기원을 확실히 알 수는 없으나 석기시대 사람들이 키운 개의 품종이 전승되어 먼 옛날 진도에서와 같이 순수한 혈통을 보존하고 있는 것으로 보인다. 땅에서. 조선 임진왜란(1592) 당시 진도의 개들은 모두 일제히 한 방향으로 짖으며 특이한 태도를 보였다. \n\n현재 진도개는 <대한민국 진도개 보호 및 사육에 관한 법률> 및 <문화재보호법>에 의거 법적으로 보호받고 있으며, 고유종으로서의 학술적 가치가 높아 천연기념물로 지정 보호받고 있습니다. 한국의 품종.",mrc-0-003312,후각과 청각이 발달한 진도개의 탁월함은 무엇에 적합한가?,진도의 진도개
469,"{'answer_start': [233], 'text': ['부리']}","성체 조류는 연구가 많지 않아 재생 능력이 매우 제한적인 것으로 알려져 있다. 수탉에 대한 일부 연구에 따르면 새는 팔다리의 일부를 적절하게 재생할 수 있으며 특정 근골격 구조는 동물의 나이, 손상된 조직과 기타 조직 간의 상호 관계와 같은 재생이 일어나는 조건의 영향을 받을 수 있습니다. 근육, 그리고 재생 작용의 유형. 완전한 재생이 포함될 수 있다고 제안됩니다.  웨버와 골드스미스(1909)는 거위와 오리는 부리가 일부 잘렸을 때 재생되는 것을 발견했, 시도로바(1962)는 수탉의 간비대를 통해서 간 재생을 관찰했다. 누출은 소음 손상 및 이독성 약물로 인한 손상 후 달팽이관의 유모 세포를 재생할 수 있습니다. 이러한 증거에도 불구하고 최근 연구에 따르면 조류의 반복 재생은 배아 발달 시기에 제한됩니다. 여러 분자 생물학 기술은 닭 배아에서 성공적인 자발적 재생을 가능하게 하는 세포 경로를 조작했습니다. 예를 들어, 창 절제술 또는 절편 절제술을 사용하여 닭 배아에서 팔꿈치 관절의 일부를 제거하고 연골 마커를 관절 조직 특정 마커와 비교함으로써 창 절제술은 20건 중 10건에서 사지 재생 및 발달을 초래합니다. 와 유사한 관절 유전자를 발현하는 것으로 나타났다. 반면에 절편절제술은 연골표지자의 발현에 의해 유도된 골격요소의 융합으로 관절의 재생을 유도하지 못하였다. \n\n포유류에서 볼 수 있는 모발의 생리적 재생과 유사하게, 새는 깃털을 재생하여 손상된 깃털을 복구하거나 깃털을 사용하여 짝을 유인할 수 있습니다. 일반적으로 번식기와 관련된 계절적 변화는 새의 깃털 재생을 시작하는 호르몬 신호에 의해 자극됩니다. 로드 아일랜드 닭의 갑상선 호르몬을 사용하여 실험적으로 유도되었습니다.",mrc-0-000694,손상 된 후 재생 가능한 거위와 오리의 신체 부위는?,재생 (생물학)
772,"{'answer_start': [136], 'text': ['스코틀랜드']}","2010년 교황 베네딕토 16세의 영국 방문은 2010년 9월 16일부터 9월 19일까지(교황 요한 바오로 1982년) 로마 가톨릭 교회 교황 베네딕토 16세의 국빈 공식 방문은 처음이다. 2년차 방송은 직접 방문).  교황 베네딕토 16세는 스코틀랜드 방문을 시작으로 엘리자베스 2세와 런던 시장 보리스 존슨을 만났으며, 추후 영국 수상 데이비드 캐머런과 영국 성공회 캔터베리 대주교 로완 윌리엄스와도 면담했다. \n\n 이번 방문은 얼마 전 발생한 천주교 신부의 아동 성추행 사건과 관련하여 언론의 많은 주목을 받았습니다. 리처드 도킨스와 크리스토퍼 히친스와 같은 호전적인 무신론자들은 현 교황이 1985년 성폭행 사건에서 성희롱을 당한 사제들을 보호하고 영국에서 그랬던 것처럼 전 칠레 독재자 피노체트의 체포를 요구했다는 사실을 인용한다. \n\n이번 방문 역시 높은 비용, 특히 가톨릭의 여성 차별, 낙태 반대, 동성애 반대, 인공 피임 거부로 인한 AIDS 확산 등으로 비판을 받고 있으며, 이러한 이유로 Stephen Fry, Richard Fifty 영국 지식인 도킨스를 포함해 일간지 가디언에 교황이 국빈으로 취급되어서는 안 된다고 주장하는 항의 성명을 발표했다. \n\n교황은 17일 몰타로 떠났다.",mrc-0-001182,교황 베네딕토 16세가 영국에서 가장 먼저 찾아간 곳은?,교황 베네딕토 16세의 영국 방문
298,"{'answer_start': [6], 'text': ['귈리엘모']}","시칠리아의 귈리엘모 왕은 아들이 젊을 때 죽어, 그 아들이 남긴 손자가 있었는데, 그 손자의 이름은 제르비노로, 잘생긴 용모와 뛰어난 무용으로 알려져 있었다. 한편, 튀니스의 공주도 미모로 세계적으로 유명했고, 세월이 지날수록 제르비노는 튀니스의 공주를 동경했고, 튀니스의 공주는 게르비노를 동경했다. 두 사람은 만난 적도 없고, 가끔 편지를 주고받으면서도 깊은 사랑에 빠진다. \n\n그러나 튀니스의 공주는 다른 나라의 왕자와 결혼하게 되고, 공주가 Gerbino에 대한 이야기를 거부하자 튀니스의 왕은 시칠리아의 왕 Guillielmo에게 공주의 결혼식을 평화롭게 진행해 줄 것을 요청합니다. 나는 당신이 당신의 도움을 선언하기를 요청합니다. 길리엘모 왕은 젊은이들의 로맨스에 관심이 없었기 때문에 비밀도 모르고 국가 간의 우호를 위해 선언에 응한다. \n\n결국 튀니스의 공주는 결혼을 하고 게르비노에게 이 사실을 알린다. Jerbino는 부하들을 데리고 배를 타고 떠나 튀니스가 결혼할 배를 공격합니다. Jerbino는 공주만을 원하며, 부하들에게 모든 보물과 전리품을 자유롭게 나누라고 말하며 치열하게 싸웁니다. 그리하여 Gerbino는 처음으로 멀리서 배에 탄 공주를 봅니다. 싸우는 동안 공주는 성난 적에게 Gerbino의 눈앞에서 잘려 바다에 던져집니다. 결국 제르비노가 얻은 것은 공주의 시신뿐이었고, 싸움이 끝난 후 튀니스의 왕이 길리엘모 왕에게 항의하자 길리엘모 왕은 책임을 지기 위해 눈물을 흘리며 그를 죽음에 이르게 한다.",mrc-1-000460,튀니스의 왕이 딸의 정략결혼을 원활히 진행하기 위해 도움을 청한 사람은?,데카메론의 줄거리
318,"{'answer_start': [250], 'text': ['「솔라 레이」']}","3함대는 일반형 돌격정을 배치하고 솔로몬에게 빔재밍 실드를 형성하는 특수 미사일을 발사하여 빔을 확산시켜 대부분의 요새 주포와 대공포가 무력화되었다. 그러나 그것은 연방군의 빔 캐논을 봉인한 결과이기도 하다. 그렇기 때문에 Dozzle 중장은 이 작전을 MMS 전투에 끌어들이기 위한 전술이라고 생각했지만, 연방은 다른 계산을 하고 있었다.  이 작전은 사이드１의 암초 주역에 숨어 있었던 연방 주력인 티안무 함대가 연방군의 요새 공략용 비밀 병기「솔라 레이」를 솔로몬으로 향하여 전개하는 시간을 벌어들일 요량으로 실행된 작전이었던 것이다. 전투 중에 나타난 천무함대에 대응하여 Dozel 중장도 전함 Guwaran을 주력으로 유격함대를 출격시켰으나 세력의 차이가 커져 증원을 요구하는 목소리가 나왔다. 병사들의 목소리가 커졌다. 그러나 Dozzle 중장은 요청을 기각했습니다. 형제에게 도움을 요청하는 것은 자존심 때문에 허용되지 않았습니다. 이것은 솔로몬에게 치명적이었습니다. 연맹은 400만 조각의 거대한 반사 거울을 사용하여 요새에 빛을 집중시키고 태양 광선으로 불태워 버렸습니다. 솔로몬의 요새 시설, 온존 함대와 게릴라 함대, 그리고 대량의 MMS가 ""태양계""라는 예상치 못한 무기의 공격으로 파괴되었습니다. \n\n전투의 주도권은 연맹으로 이양되었고, 연맹의 MMS 부대는 솔로몬을 향해 진격하고 있었다. 맥베 대령이 이끄는 솔로몬 지원함대는 이미 그라나다를 출격하고 있었지만 제시간에 도착할 것 같지 않았다. 전 병력의 4분의 3을 잃은 도즐 중장은 남은 함선과 MMS를 솔로몬에 집결시켜 최후의 전투를 결의하고 프로토타입 거대 기동장갑 '빅잼'을 타고 출격했다. 강력한 확산 빔 캐논과 빔 배리어를 장착한 빅잼의 전투력은 압도적이었고, 방어력이 약한 연방 함대는 태양계의 세컨드 샷에 이목을 집중시키며 무방비 상태가 되었다. Vic Jam은 순식간에 5척의 전함과 8척의 순양함을 침몰시켰습니다. 여기에서 연방 건쉽 ""Titan""이 침몰하고 Tianmu 대위가 사망했습니다. 빅잼은 결국 화이트 기지의 근접 공격으로 파괴되었고, 도즐 중장은 사망했다. 그러나 중장은 목숨을 걸고 나머지 지온 함대를 사이드 3 지역에서 탈출시켰다. \n\n12월 25일, 연방 함대가 함락된 솔로몬 군도에 도착했습니다.",mrc-0-000469,연방군 요새를 공격하기 위해 티안무 함대가 준비한 것은?,일년전쟁
2908,"{'answer_start': [763], 'text': ['왕진']}","신장 생산 건설 군단(신강 생산 건설 군단)은 중화 서인민 공화국 신장 웨이워 자치구에 있는 인민 해방군(PLA)에서 멀리 떨어진 군사 조직입니다. 군단원의 88%가 한족이다. \n\n공산주의 혁명 당시 인민해방군의 전신인 신장 지역의 독특한 생산 조직으로서 농업, 임업, 축산에서 산업 및 관광에 이르기까지 신장 지역 경제 활동의 모든 영역을 지배하는 조직입니다. 특히 신장의 농업은 1949년부터 인민해방군 생산건설부대에 의해 확장되고 현대화되었습니다. 남부 오아시스와 伊犁-塔城의 전통적인 농업 중심지의 기존 농지를 확장하는 것 외에도 우루무치 북서쪽, 石河子 주변, 昌吉回人自治州 등 북부 지역에서 완전히 새로운 농지를 개간하고 관개한다. 또한 상당한 속도로 수행되었습니다. 확장 그리고 무엇보다 농업기계화는 생산단위와 건설단위에서 활발히 추진되어 1987년 현재 파종 전 쟁기질의 2/3, 파종 1/2 이상, 수확의 약 1/5이 기계로 이루어졌다. \n\n인민해방군은 1949년 국민당에서 평화롭게 신장 지역을 점령한 후 다른 지역과 마찬가지로 10만 명의 군인을 신장 지역에 파견하여 생산 및 건설 군단을 구성했습니다. 그 중 가장 중요한 군단은 흑룡강성, 내몽골, 티베트, 하이난도에 창설된 군단이었지만 그 중 가장 중요한 군단은 신장에 있는 군단이었다. 1975년에 다른 생산건설단은 모두 문을 닫았지만 1982년에는 신장 생산건설단만이 유일하게 부활했기 때문이다.  신강의 병단은 1950년 처음 설립되었을 때, 당시 이 지역 최고 군 지도자였던 왕진의 지휘 아래서, 군사․정치․경제 방면의 다양하고 복합적인 기능을 수행했다. 처음에는 대부분의 인원이 군인이었으나 점차 지방 출신이 아닌 동해안 지방에서 파견된 젊은이들로 대체되었다. 군단은 국경 수비 임무를 가진 준군사 기관이며 항상 공산당의 정치적 입장을 지원하는 임무를 맡았지만 토지 개간, 도로와 같은 기반 시설 건설, 특정 작물 촉진, 새로운 개발과 같은 다양한 활동을 수행합니다. 산업 및 광산. 또한 주요 경제 임무도 수행했습니다. 북강과 남강 일대에 농장, 목장, 공업기업, 군단산하의 비농업기업이 존재하지만 그 활동의 범위와 규모는 북강지역이 더 활발하다.",mrc-0-004461,1950년 신강지역에서 최고 군 지도자 지위에 있었던 사람은?,신장 생산 건설 병단
2937,"{'answer_start': [426], 'text': ['80%']}","바다새우 양식\n 상업적 바다새우 양식은 1970년에 시작되었으며 특히 미국, 일본 및 서유럽에서 시장 수요에 보조를 맞추기 위해 생산량이 급격히 증가했습니다. 양식 새우의 세계 총 생산량은 2003년에 1,600만 톤에 달했으며 그 가치는 거의 90억 달러에 달했습니다. 양식 새우의 70%는 아시아, 특히 중국과 인도네시아에서 옵니다. 나머지는 주로 라틴 아메리카에서 생산되며 브라질, 에콰도르, 멕시코에서 가장 많이 생산됩니다. 최대 수출국은 인도네시아다. \n\n동남아의 새우 양식업은 전통적인 소규모 사업에서 국제 사업으로 전환되었습니다. 기술 발전으로 새우를 매우 조밀하게 재배할 수 있게 되었으며 활어를 전 세계로 운송할 수 있게 되었습니다.  거의 모든 양식 새우는 보리새우과에 속하며, 흰다리새우와 블랙타이거새우의 단 두 종이 모든 양식 새우의 80%를 차지한다. 이 산업적 단일 양식은 질병에 매우 취약하며 특정 지역에서 양식 새우가 멸종된 사례가 여러 번 있었습니다. 증가하는 생태학적 문제, 반복되는 질병 전염병, NGO와 소비국의 압력과 비판은 1990년대 후반 산업 관행을 변화시켰고 일반적으로 정부 규제를 강화했습니다. 1999년에는 정부 기관, 업계 대표 및 환경 단체가 참여하여 보다 지속 가능한 양식을 개발하고 촉진하기 위한 프로그램이 시작되었습니다.",mrc-0-004502,흰다리새우와 블랙타이거새우는 양식 새우의 몇 퍼센트를 차지하나요?,새우 양식
